{
  "_theme": "economie-dette",
  "_lot": 3,
  "_statut": "VALIDÉ le 2026-10-02 — sources à recontrôler sur textes officiels avant publication",
  "_equilibre": {
    "actives": 20,
    "suspendues": 0,
    "sens_plus": 10,
    "sens_moins": 10,
    "axes": {
      "economie": 20
    }
  },
  "_note": "Sources recherchées le 2026-10-02, lues via un résumé automatique : chiffres et citations à recontrôler avant publication. Énoncés alignés sur la forme exacte des propositions documentées.",
  "questions": [
    {
      "id": "ECO-001",
      "theme": "economie-dette",
      "axe": "economie",
      "sens": 1,
      "enonce": "Le SMIC doit être porté à 1 600 euros net par mois.",
      "precision": "Le SMIC est d'environ 1 478 euros net par mois depuis le 1er juin 2026.",
      "origine": {
        "description": "Programme commun de gauche des législatives de 2024 ; montant actuel : info.gouv.fr",
        "source": {
          "url": "https://www.info.gouv.fr/actualite/le-smic-revalorise-le-1er-juin-2026",
          "titre": "Le SMIC revalorisé le 1er juin 2026",
          "date_consultation": "2026-10-02",
          "nature": "primaire"
        }
      },
      "statut": "active",
      "alertes_neutralite": [],
      "scrutins": [],
      "historique": [],
      "impact": {
        "changement": "La hausse serait d'environ 122 euros net par mois pour un temps plein, soit un peu plus de 8 %. Elle concernerait tous les salariés rémunérés au minimum légal, dont 2,2 millions selon l'exposé des motifs d'une proposition de loi déposée à l'Assemblée nationale. Le coût du travail augmenterait mécaniquement pour les employeurs de ces salariés.",
        "pour": "Ses partisans estiment qu'elle soutiendrait la consommation des ménages modestes et rattraperait une progression du SMIC plus faible, sur dix ans, que dans les autres pays de l'Union européenne. Ils citent des pays où l'emploi n'a pas reculé.",
        "contre": "Ses opposants jugent qu'elle renchérirait le coût des emplois peu qualifiés et pourrait dissuader d'embaucher. Ils redoutent que des petites entreprises à faible marge, ne pouvant répercuter la hausse sur leurs prix, ne disparaissent.",
        "sources": [
          {
            "url": "https://www.info.gouv.fr/actualite/le-smic-revalorise-le-1er-juin-2026",
            "titre": "Le SMIC revalorisé le 1er juin 2026",
            "date_consultation": "2026-10-12",
            "nature": "institutionnelle"
          },
          {
            "url": "https://www.moneyvox.fr/votre-argent/actualites/98673/smic-a-1-600-euros-les-pour-et-les-contre",
            "titre": "SMIC à 1 600 euros : les pour et les contre",
            "date_consultation": "2026-10-12",
            "nature": "secondaire"
          },
          {
            "url": "https://www.assemblee-nationale.fr/dyn/opendata/PIONANR5L17B2893.html",
            "titre": "Proposition de loi n° 2893 d'indexation des salaires sur l'inflation (exposé des motifs)",
            "date_consultation": "2026-10-12",
            "nature": "primaire"
          }
        ],
        "statut": "pilote"
      }
    },
    {
      "id": "ECO-002",
      "theme": "economie-dette",
      "axe": "economie",
      "sens": 1,
      "enonce": "Tous les salaires doivent être indexés automatiquement sur l'inflation.",
      "precision": "Aujourd'hui, seul le SMIC est indexé ; la loi interdit l'indexation automatique des autres salaires sur les prix.",
      "origine": {
        "description": "Proposition de loi n° 208 (2024-2025) déposée au Sénat le 17 décembre 2024",
        "source": {
          "url": "https://www.senat.fr/leg/ppl24-208.html",
          "titre": "Indexer les salaires sur l'inflation (PPL) — texte déposé au Sénat",
          "date_consultation": "2026-10-02",
          "nature": "primaire"
        }
      },
      "statut": "active",
      "alertes_neutralite": [],
      "scrutins": [],
      "historique": [],
      "impact": {
        "changement": "Les salaires du privé, et ceux des agents publics, seraient relevés automatiquement au moins du niveau de l'inflation. Un texte déposé à l'Assemblée prévoit deux hausses par an (1er mars, 1er septembre), sauf au-delà de deux fois le salaire médian. Un autre, au Sénat, prévoit une hausse annuelle au moins égale à l'inflation prévue. Ce système a existé de 1952 à 1983.",
        "pour": "Ses partisans estiment que les salaires progressent moins vite que les prix et que l'indexation protège le pouvoir d'achat sans dépendre des négociations. Ils rappellent que la Belgique et le Luxembourg la pratiquent déjà.",
        "contre": "Ses opposants redoutent que des hausses automatiques de salaires nourrissent de nouvelles hausses de prix et alourdissent les coûts des entreprises, surtout des petites, qui n'ont pas toujours les moyens de les absorber.",
        "sources": [
          {
            "url": "https://www.assemblee-nationale.fr/dyn/opendata/PIONANR5L17B2893.html",
            "titre": "Proposition de loi n° 2893 d'indexation des salaires sur l'inflation",
            "date_consultation": "2026-10-12",
            "nature": "primaire"
          },
          {
            "url": "https://senat.fr/leg/ppl24-208.pdf",
            "titre": "Proposition de loi n° 208 (Sénat, 2024-2025) sur l'indexation des salaires sur l'inflation",
            "date_consultation": "2026-10-12",
            "nature": "primaire"
          }
        ],
        "statut": "pilote"
      }
    },
    {
      "id": "ECO-003",
      "theme": "economie-dette",
      "axe": "economie",
      "sens": 1,
      "enonce": "Face à une flambée des prix, l'État doit bloquer temporairement les prix des biens de première nécessité dans l'alimentation, l'énergie et les carburants.",
      "precision": "Il s'agit d'un blocage limité dans le temps, décidé face à une hausse brutale des prix, et non d'un blocage permanent.",
      "origine": {
        "description": "Programme commun de gauche des législatives de 2024",
        "source": {
          "url": "https://www.zoomdici.fr/sites/default/files/upload/documents/lhumanite-presente-le-programme-du-nouveau-front-populaire.pdf",
          "titre": "Programme du Nouveau Front populaire (juin 2024), copie hébergée par un site tiers",
          "date_consultation": "2026-10-02",
          "nature": "secondaire"
        }
      },
      "statut": "active",
      "alertes_neutralite": [
        {
          "signalement": "trois secteurs dans un énoncé : ils sont réunis dans la proposition d'origine",
          "decision": "un seul énoncé conservé"
        }
      ],
      "scrutins": [],
      "historique": [
        {
          "date": "2026-10-12",
          "ancien_enonce": "Les prix des biens de première nécessité doivent être bloqués dans l'alimentation, l'énergie et les carburants."
        }
      ],
      "impact": {
        "changement": "Aujourd'hui, les prix sont libres, mais l'État peut les encadrer par décret pour six mois au plus en cas de crise ou de situation anormale du marché. Deux propositions de loi de 2026 portent sur l'énergie : l'une plafonne gaz et carburants six mois (renouvelables une fois) à leur moyenne des douze mois précédents ; l'autre gèle carburants, gaz et électricité trois mois au plus. Aucun texte consulté ne vise l'alimentation.",
        "pour": "Ses partisans estiment que les prix de première nécessité s'envolent sous l'effet de crises et de spéculations, et que la puissance publique doit pouvoir protéger les ménages. Selon eux, les marges des grands groupes permettent d'absorber un plafonnement.",
        "contre": "Ses opposants craignent des pénuries ou des retraits de produits quand le prix imposé devient inférieur aux coûts. Ils jugent aussi qu'un blocage se heurte au droit européen et se justifie mal quand l'inflation recule.",
        "sources": [
          {
            "url": "https://www.senat.fr/leg/ppl25-453.pdf",
            "titre": "Proposition de loi n° 453 (Sénat, 2025-2026) visant à plafonner les prix du gaz et des carburants",
            "date_consultation": "2026-10-12",
            "nature": "primaire"
          },
          {
            "url": "https://lcp.fr/actualites/essence-lfi-depose-une-proposition-de-loi-pour-bloquer-les-prix-432389",
            "titre": "Essence : LFI dépose une proposition de loi pour bloquer les prix",
            "date_consultation": "2026-10-12",
            "nature": "secondaire"
          },
          {
            "url": "https://www.leclubdesjuristes.com/economie/le-blocage-des-prix-sur-les-produits-de-premiere-necessite-oui-mais-6385/",
            "titre": "Le blocage des prix sur les produits de première nécessité ? Oui, mais…",
            "date_consultation": "2026-10-12",
            "nature": "secondaire"
          }
        ],
        "statut": "pilote"
      }
    },
    {
      "id": "ECO-004",
      "theme": "economie-dette",
      "axe": "economie",
      "sens": 1,
      "enonce": "La durée légale du travail doit être ramenée à 32 heures par semaine dans les métiers pénibles ou de nuit.",
      "precision": "La durée légale est de 35 heures par semaine pour tous les salariés.",
      "origine": {
        "description": "Programme commun de gauche des législatives de 2024 ; amendement n° 12 (rect.) du 22 juin 2026",
        "source": {
          "url": "https://www.assemblee-nationale.fr/dyn/17/amendements/2790/AN/12.pdf",
          "titre": "Amendement n° 12 (rect.) au texte n° 2790 (22 juin 2026)",
          "date_consultation": "2026-10-02",
          "nature": "primaire"
        }
      },
      "statut": "active",
      "alertes_neutralite": [
        {
          "signalement": "les 32 heures pour tous ne sont proposées par personne dans les sources trouvées",
          "decision": "énoncé aligné sur la mesure documentée"
        }
      ],
      "scrutins": [],
      "historique": [],
      "impact": {